{
  "schemaVersion": "codeclew-node-contract/0",
  "planStatus": "PROPOSED_AWAITING_HUMAN_APPROVAL",
  "manifestScope": ["R01", "R02", "R03", "GK"],
  "manifests": [
    {
      "id": "R01",
      "status": "BLOCKED_ON_A00",
      "kind": "CONTRACT",
      "goal": "Freeze all source digests, research claims, hypotheses, gaps, bibliography provenance and supported boundaries.",
      "hypothesisIds": ["ALL"],
      "hardPredecessors": ["A00:HUMAN_APPROVED"],
      "readFirst": [
        "evidence/graphs/${PLAN_DIGEST}/approval-bundle.json",
        "project.md",
        "docs/experiments/deep-research-codeclew-semantic-editing-results.md",
        "docs/superpowers/plans/2026-08-02-codeclew-corpus-first-plan.md",
        "docs/experiments/codeclew-research-plan-coverage-verification-2026-08-02.md",
        "/workspace/user/Downloads/codeclew_dr2.txt",
        "/workspace/user/Downloads/codeclew_dr3.md",
        "docs/superpowers/plans/2026-08-08-codeclew-cumulative-evidence-graph-plan.md",
        "docs/superpowers/plans/2026-08-08-codeclew-cumulative-evidence-graph.dot",
        "docs/superpowers/plans/2026-08-08-codeclew-terminal-synthesis-v0.json"
      ],
      "boundedWork": [
        "Recompute S0-S5 hashes and archive external-source provenance.",
        "Create bidirectional source-claim-hypothesis-gap mapping.",
        "Resolve external citations to primary URL or DOI and mark unresolved items UNVERIFIED.",
        "Freeze the supported Kotlin contour, forbidden claims and branch-code registry inputs.",
        "Materialize the bounded untested cross-language specification scaffold required by S4 questions 25-26.",
        "Materialize a synthetic-data clickable offline evidence-view prototype for later Q03 refinement."
      ],
      "nonGoals": [
        "No product implementation, corpus generation, benchmark execution or threshold change."
      ],
      "expectedEvidenceDelta": "Every mandatory source claim has a falsifier, destination node, evidence class and verified provenance status.",
      "outputArtifacts": [
        "docs/research/codeclew/source-manifest.json",
        "docs/research/codeclew/hypotheses.yaml",
        "docs/research/codeclew/gap-register.yaml",
        "docs/research/codeclew/coverage-boundary.md",
        "docs/research/codeclew/bibliography-lock.json",
        "docs/research/codeclew/source-to-claim-trace.md",
        "docs/research/codeclew/cross-language-specification-scaffold.md",
        "docs/research/codeclew/evidence-view-prototype/index.html",
        "evidence/graphs/${PLAN_DIGEST}/packets/R01/${ATTEMPT}/packet.json",
        "evidence/graphs/${PLAN_DIGEST}/packets/R01/${ATTEMPT}/summary.md"
      ],
      "genericOutcomeArtifacts": [
        "evidence/graphs/${PLAN_DIGEST}/diagnostics/R01/${ATTEMPT}/failure.json",
        "evidence/graphs/${PLAN_DIGEST}/packets/R01/${ATTEMPT}/packet.json",
        "evidence/graphs/${PLAN_DIGEST}/packets/R01/${ATTEMPT}/summary.md"
      ],
      "verificationCommands": [
        "shasum -a 256 project.md docs/experiments/deep-research-codeclew-semantic-editing-results.md docs/superpowers/plans/2026-08-02-codeclew-corpus-first-plan.md docs/experiments/codeclew-research-plan-coverage-verification-2026-08-02.md /workspace/user/Downloads/codeclew_dr2.txt /workspace/user/Downloads/codeclew_dr3.md",
        "ruby -rjson -e 'ARGV.each { |path| JSON.parse(File.read(path)) }' docs/research/codeclew/source-manifest.json docs/research/codeclew/bibliography-lock.json",
        "ruby -ryaml -e 'ARGV.each { |path| YAML.safe_load(File.read(path), aliases: false) }' docs/research/codeclew/hypotheses.yaml docs/research/codeclew/gap-register.yaml"
      ],
      "independentVerifierChecks": [
        "Recompute every source digest and verify HEAD provenance.",
        "Check all 32 DR2 questions, 22 deliverables and T00-T23 in both trace directions.",
        "Confirm that unresolved literature is UNVERIFIED and cannot support a gate.",
        "Verify that the cross-language scaffold is bounded to declared observables and explicitly forbids universal transpilation claims.",
        "Exercise the offline prototype clickable provenance, Unknown and freshness paths with synthetic data."
      ],
      "requiredCheckIds": [
        "SOURCE_DIGESTS",
        "MANDATORY_TRACE_COVERAGE",
        "UNVERIFIED_SOURCE_GATE_EXCLUSION",
        "CROSS_LANGUAGE_SCAFFOLD_BOUNDARY",
        "CLICKABLE_EVIDENCE_PROTOTYPE",
        "TEAM_BUDGET_ENFORCEMENT"
      ],
      "budgets": {
        "noncachedTokenCeiling": 180000,
        "outputTokenCeiling": 30000,
        "toolCallCeiling": 60,
        "wallMinutesCeiling": 90,
        "perTurnVisibleContextBytes": 65536
      },
      "retryPolicy": {
        "maxProducerAttempts": 2,
        "maxInfrastructureReruns": 1,
        "noProgressRule": "same failure fingerprint twice without accepted evidence delta"
      },
      "retryableGenericBranchCodes": ["REVISE_PLAN_SOURCE_COVERAGE"],
      "passPredicate": "All S0-S5 digests match, mandatory mappings are bidirectionally complete, no UNVERIFIED source supports a gate claim, and the bounded scaffold plus clickable synthetic prototype pass their source-level checks.",
      "allowedOutcomes": ["SUCCESS", "FAILURE", "REFUSED", "BLOCKED", "NO_PROGRESS", "INFRA_ERROR"],
      "branchCodes": ["NONE", "REVISE_PLAN_SOURCE_COVERAGE", "BLOCK_UNVERIFIED_PROVENANCE", "BUDGET_EXCEEDED"]
    },
    {
      "id": "R02",
      "status": "BLOCKED_ON_A00",
      "kind": "CONTRACT",
      "goal": "Publish and negatively test execution-time evidence, telemetry, budget, event-clock and experiment-integrity contracts.",
      "hypothesisIds": ["H03", "H04", "H05", "H06", "H07", "H08", "H09", "H10", "H11", "H12"],
      "hardPredecessors": ["R01:SUCCESS/NONE"],
      "readFirst": [
        "evidence/graphs/${PLAN_DIGEST}/approval-bundle.json",
        "docs/superpowers/plans/2026-08-08-codeclew-cumulative-evidence-graph-plan.md",
        "docs/superpowers/plans/2026-08-08-codeclew-cumulative-evidence-graph.dot",
        "docs/superpowers/plans/2026-08-08-codeclew-node-contract-v0.schema.json",
        "docs/superpowers/plans/2026-08-08-codeclew-bootstrap-manifests-v0.json",
        "docs/superpowers/plans/2026-08-08-codeclew-evidence-packet-v0.schema.json",
        "docs/superpowers/plans/2026-08-08-codeclew-verification-receipt-v0.schema.json",
        "docs/superpowers/plans/2026-08-08-codeclew-bootstrap-contract-fixtures-v0.json",
        "docs/superpowers/plans/2026-08-08-codeclew-terminal-synthesis-v0.json",
        "docs/research/codeclew/source-manifest.json",
        "docs/research/codeclew/hypotheses.yaml",
        "docs/research/codeclew/gap-register.yaml"
      ],
      "boundedWork": [
        "Create NodeContract-v1, EvidencePacket and VerificationReceipt schemas and validator.",
        "Freeze outcome, branch-code, retry, invalidation and conditional-join semantics.",
        "Freeze native token, preprocessing, event-clock, compute and full-team cost accounting.",
        "Freeze exact statistical estimands, non-inferiority margin, missing-data, exclusions and budgets.",
        "Freeze corpus-commitment, final-system-lock, X04-only H12 decision and exact GF 1-32/1-22 report contracts."
      ],
      "nonGoals": [
        "No semantic kernel, editing transform, conflict detector or benchmark outcome."
      ],
      "expectedEvidenceDelta": "All descendant runs become schema-valid, cost-complete and unable to unlock a successor with a verified negative outcome.",
      "outputArtifacts": [
        "schemas/evidence/node-contract-v1.schema.json",
        "schemas/evidence/evidence-packet-v1.schema.json",
        "schemas/evidence/verification-receipt-v1.schema.json",
        "schemas/evidence/corpus-commitment-v1.schema.json",
        "schemas/evidence/final-system-lock-v1.schema.json",
        "schemas/evidence/h12-decision-v1.schema.json",
        "schemas/evidence/answers-01-32-v1.schema.json",
        "schemas/evidence/deliverable-manifest-v1.schema.json",
        "benchmarks/protocol/run-manifest-v1.schema.json",
        "benchmarks/protocol/events-v1.json",
        "benchmarks/protocol/budgets-v1.json",
        "docs/experiments/codeclew-benchmark-protocol-v1.md",
        "scripts/validate-evidence-contracts.sh",
        "evidence/graphs/${PLAN_DIGEST}/checks/R02/negative-packets.json",
        "evidence/graphs/${PLAN_DIGEST}/checks/R02/team-token-reconciliation.json",
        "evidence/graphs/${PLAN_DIGEST}/checks/R02/token-unavailable-branch.json",
        "evidence/graphs/${PLAN_DIGEST}/checks/R02/dot-vocabulary-closure.json",
        "evidence/graphs/${PLAN_DIGEST}/checks/R02/final-freeze-report-contracts.json",
        "evidence/graphs/${PLAN_DIGEST}/checks/R02/team-budget-enforcement.json",
        "evidence/graphs/${PLAN_DIGEST}/packets/R02/${ATTEMPT}/packet.json",
        "evidence/graphs/${PLAN_DIGEST}/packets/R02/${ATTEMPT}/summary.md"
      ],
      "genericOutcomeArtifacts": [
        "evidence/graphs/${PLAN_DIGEST}/diagnostics/R02/${ATTEMPT}/failure.json",
        "evidence/graphs/${PLAN_DIGEST}/packets/R02/${ATTEMPT}/packet.json",
        "evidence/graphs/${PLAN_DIGEST}/packets/R02/${ATTEMPT}/summary.md"
      ],
      "verificationCommands": [
        "ruby -rjson -e 'ARGV.each { |path| JSON.parse(File.read(path)) }' schemas/evidence/node-contract-v1.schema.json schemas/evidence/evidence-packet-v1.schema.json schemas/evidence/verification-receipt-v1.schema.json schemas/evidence/corpus-commitment-v1.schema.json schemas/evidence/final-system-lock-v1.schema.json schemas/evidence/h12-decision-v1.schema.json schemas/evidence/answers-01-32-v1.schema.json schemas/evidence/deliverable-manifest-v1.schema.json benchmarks/protocol/run-manifest-v1.schema.json benchmarks/protocol/events-v1.json benchmarks/protocol/budgets-v1.json",
        "./scripts/validate-evidence-contracts.sh --negative-fixtures",